1587148076.012249 Ether / IP / TCP 192.168.1.106:61410 > 216.58.203.42:https FPA / Raw
1587148076.154223 Ether / IP / TCP 185.199.109.154:https > 192.168.1.106:61334 A
1587148076.154334 Ether / IP / TCP 192.168.1.106:61334 > 185.199.109.154:https A
1587148076.239978 Ether / IP / TCP 185.199.109.154:https > 192.168.1.106:61334 A
1587148076.495212 Ether / IP / TCP 192.168.1.106:61387 > 104.244.42.194:https PA / Raw
1587148076.495791 Ether / IP / TCP 192.168.1.106:61387 > 104.244.42.194:https PA / Raw
1587148076.495792 Ether / IP / TCP 192.168.1.106:61387 > 104.244.42.194:https FA
1587148076.597057 Ether / IP / TCP 104.244.42.194:https > 192.168.1.106:61387 A
1587148076.597215 Ether / IP / TCP 104.244.42.194:https > 192.168.1.106:61387 A
1587148076.597275 Ether / IP / TCP 192.168.1.106:61387 > 104.244.42.194:https A / Raw
1587148076.597466 Ether / IP / TCP 104.244.42.194:https > 192.168.1.106:61387 PA / Raw
1587148076.597580 Ether / IP / TCP 192.168.1.106:61387 > 104.244.42.194:https R
1587148076.597626 Ether / IP / TCP 104.244.42.194:https > 192.168.1.106:61387 FA
1587148076.597656 Ether / IP / TCP 192.168.1.106:61387 > 104.244.42.194:https R
1587148076.694980 Ether / IP / TCP 104.244.42.194:https > 192.168.1.106:61387 R
1587148077.132751 Ether / IP / TCP 185.199.110.154:https > 192.168.1.106:61333 A
1587148077.132970 Ether / IP / TCP 192.168.1.106:61333 > 185.199.110.154:https A
1587148077.228181 Ether / IP / TCP 185.199.110.154:https > 192.168.1.106:61333 A
1587148078.905736 Ether / IP / TCP 192.168.1.106:61410 > 216.58.203.42:https FPA / Raw
1587148079.574061 Ether / ARP who has 192.168.1.106 says 192.168.1.254 / Padding
1587148079.574130 Ether / ARP is at 8c:85:90:b2:22:b5 says 192.168.1.106
1587148081.412688 Ether / IP / TCP 172.217.166.46:https > 192.168.1.106:61417 A
1587148081.412793 Ether / IP / TCP 192.168.1.106:61417 > 172.217.166.46:https A
1587148081.452657 Ether / IP / TCP 172.217.166.46:https > 192.168.1.106:61417 A
1587148081.798525 Ether / IP / TCP 192.168.1.106:61410 > 216.58.203.42:https FPA / Raw
1587148084.623976 Ether / ARP who has 192.168.1.106 says 192.168.1.254 / Padding
1587148084.624026 Ether / ARP is at 8c:85:90:b2:22:b5 says 192.168.1.106
1587148084.687762 Ether / IP / TCP 192.168.1.106:61410 > 216.58.203.42:https FPA / Raw
1587148086.212864 Ether / IP / TCP 140.82.112.26:https > 192.168.1.106:61413 A
1587148086.212944 Ether / IP / TCP 192.168.1.106:61413 > 140.82.112.26:https A
1587148086.454951 Ether / IP / TCP 140.82.112.26:https > 192.168.1.106:61413 A
1587148086.992901 Ether / IP / TCP 172.217.166.42:https > 192.168.1.106:61409 A
1587148086.993012 Ether / IP / TCP 192.168.1.106:61409 > 172.217.166.42:https A
1587148087.034422 Ether / IP / TCP 172.217.166.42:https > 192.168.1.106:61409 A
1587148087.161770 Ether / IP / UDP 192.168.1.106:52417 > 239.255.255.250:1900 / Raw
1587148087.580538 Ether / IP / TCP 192.168.1.106:61410 > 216.58.203.42:https FPA / Raw
1587148088.163226 Ether / IP / UDP 192.168.1.106:52417 > 239.255.255.250:1900 / Raw
1587148088.479813 Ether / IP / TCP 192.168.1.106:61348 > 17.57.145.52:5223 FPA / Raw
1587148089.163542 Ether / IP / UDP 192.168.1.106:52417 > 239.255.255.250:1900 / Raw
1587148089.377160 Ether / IP / TCP 192.168.1.106:61444 > 192.168.1.254:8013 S
1587148089.378546 Ether / IP / TCP 192.168.1.254:8013 > 192.168.1.106:61444 RA
1587148089.673954 Ether / ARP who has 192.168.1.106 says 192.168.1.254 / Padding
1587148089.673991 Ether / ARP is at 8c:85:90:b2:22:b5 says 192.168.1.106
1587148089.754221 Ether / IP / TCP 192.168.1.106:61446 > 9.9.9.9:https S
1587148089.769156 Ether / IP / TCP 9.9.9.9:https > 192.168.1.106:61446 SA
1587148089.769231 Ether / IP / TCP 192.168.1.106:61446 > 9.9.9.9:https A
1587148089.770583 Ether / IP / TCP 192.168.1.106:61446 > 9.9.9.9:https PA / Raw
1587148089.784025 Ether / IP / TCP 9.9.9.9:https > 192.168.1.106:61446 A
1587148089.784430 Ether / IP / TCP 9.9.9.9:https > 192.168.1.106:61446 PA / Raw
1587148089.784483 Ether / IP / TCP 192.168.1.106:61446 > 9.9.9.9:https A
1587148089.785092 Ether / IP / TCP 192.168.1.106:61446 > 9.9.9.9:https PA / Raw
1587148089.794758 Ether / IP / TCP 192.168.1.106:61446 > 9.9.9.9:https PA / Raw
1587148089.794822 Ether / IP / TCP 192.168.1.106:61446 > 9.9.9.9:https PA / Raw
1587148089.794823 Ether / IP / TCP 192.168.1.106:61446 > 9.9.9.9:https PA / Raw
1587148089.806944 Ether / IP / TCP 9.9.9.9:https > 192.168.1.106:61446 A
1587148089.806948 Ether / IP / TCP 9.9.9.9:https > 192.168.1.106:61446 PA / Raw
1587148089.807048 Ether / IP / TCP 192.168.1.106:61446 > 9.9.9.9:https A
1587148089.807279 Ether / IP / TCP 192.168.1.106:61446 > 9.9.9.9:https PA / Raw
1587148089.807942 Ether / IP / TCP 9.9.9.9:https > 192.168.1.106:61446 PA / Raw
1587148089.808071 Ether / IP / TCP 192.168.1.106:61446 > 9.9.9.9:https A
1587148089.808707 Ether / IP / TCP 192.168.1.106:61447 > 172.217.167.164:https S
1587148089.860847 Ether / IP / TCP 9.9.9.9:https > 192.168.1.106:61446 A
1587148089.868250 Ether / IP / TCP 172.217.167.164:https > 192.168.1.106:61447 SA
1587148089.868402 Ether / IP / TCP 192.168.1.106:61447 > 172.217.167.164:https A
1587148089.871102 Ether / IP / TCP 192.168.1.106:61447 > 172.217.167.164:https PA / Raw
1587148089.872941 Ether / IP / TCP 192.168.1.106:61447 > 172.217.167.164:https FA
1587148089.929175 Ether / IP / TCP 172.217.167.164:https > 192.168.1.106:61447 A
1587148089.929182 Ether / IP / TCP 172.217.167.164:https > 192.168.1.106:61447 A
1587148089.929333 Ether / IP / TCP 192.168.1.106:61447 > 172.217.167.164:https FPA / Raw
1587148089.929643 Ether / IP / TCP 172.217.167.164:https > 192.168.1.106:61447 PA / Raw
1587148089.929650 Ether / IP / TCP 172.217.167.164:https > 192.168.1.106:61447 FA
1587148089.929854 Ether / IP / TCP 192.168.1.106:61447 > 172.217.167.164:https R
1587148089.929855 Ether / IP / TCP 192.168.1.106:61447 > 172.217.167.164:https R
1587148089.931591 Ether / IP / TCP 192.168.1.106:61448 > 172.217.167.164:https S
1587148089.981877 Ether / IP / TCP 172.217.167.164:https > 192.168.1.106:61448 SA
1587148089.981951 Ether / IP / TCP 192.168.1.106:61448 > 172.217.167.164:https A
1587148089.983310 Ether / IP / TCP 192.168.1.106:61448 > 172.217.167.164:https PA / Raw
1587148089.988642 Ether / IP / TCP 172.217.167.164:https > 192.168.1.106:61447 R
1587148090.034524 Ether / IP / TCP 172.217.167.164:https > 192.168.1.106:61448 A
1587148090.035372 Ether / IP / TCP 172.217.167.164:https > 192.168.1.106:61448 PA / Raw
1587148090.035418 Ether / IP / TCP 192.168.1.106:61448 > 172.217.167.164:https A
1587148090.036019 Ether / IP / TCP 192.168.1.106:61448 > 172.217.167.164:https PA / Raw
1587148090.037824 Ether / IP / TCP 192.168.1.106:61448 > 172.217.167.164:https PA / Raw
1587148090.037892 Ether / IP / TCP 192.168.1.106:61448 > 172.217.167.164:https PA / Raw
1587148090.087701 Ether / IP / TCP 172.217.167.164:https > 192.168.1.106:61448 PA / Raw
1587148090.087707 Ether / IP / TCP 172.217.167.164:https > 192.168.1.106:61448 PA / Raw
1587148090.087853 Ether / IP / TCP 192.168.1.106:61448 > 172.217.167.164:https A
1587148090.087854 Ether / IP / TCP 192.168.1.106:61448 > 172.217.167.164:https A
1587148090.088401 Ether / IP / TCP 192.168.1.106:61448 > 172.217.167.164:https PA / Raw
1587148090.144964 Ether / IP / TCP 172.217.167.164:https > 192.168.1.106:61448 A
1587148090.164848 Ether / IP / UDP 192.168.1.106:52417 > 239.255.255.250:1900 / Raw
1587148090.183648 Ether / IP / TCP 172.217.167.164:https > 192.168.1.106:61448 PA / Raw
1587148090.183655 Ether / IP / TCP 172.217.167.164:https > 192.168.1.106:61448 PA / Raw
1587148090.183800 Ether / IP / TCP 192.168.1.106:61448 > 172.217.167.164:https A
1587148090.183801 Ether / IP / TCP 192.168.1.106:61448 > 172.217.167.164:https A
1587148090.186257 Ether / IP / TCP 172.217.167.164:https > 192.168.1.106:61448 PA / Raw
1587148090.186262 Ether / IP / TCP 172.217.167.164:https > 192.168.1.106:61448 PA / Raw
1587148090.186342 Ether / IP / TCP 192.168.1.106:61448 > 172.217.167.164:https A
1587148090.186342 Ether / IP / TCP 192.168.1.106:61448 > 172.217.167.164:https A
1587148090.187122 Ether / IP / TCP 172.217.167.164:https > 192.168.1.106:61448 PA / Raw
1587148090.187214 Ether / IP / TCP 192.168.1.106:61448 > 172.217.167.164:https A
1587148090.187426 Ether / IP / TCP 192.168.1.106:61448 > 172.217.167.164:https PA / Raw
1587148090.237855 Ether / IP / TCP 172.217.167.164:https > 192.168.1.106:61448 A
1587148090.487782 Ether / IP / TCP 192.168.1.106:61410 > 216.58.203.42:https RA
1587148091.707830 Ether / IP / TCP 192.168.1.106:61446 > 9.9.9.9:https PA / Raw
1587148091.707946 Ether / IP / TCP 192.168.1.106:61446 > 9.9.9.9:https PA / Raw
1587148091.718681 Ether / IP / TCP 9.9.9.9:https > 192.168.1.106:61446 A
1587148091.718938 Ether / IP / TCP 9.9.9.9:https > 192.168.1.106:61446 A
1587148091.719245 Ether / IP / TCP 9.9.9.9:https > 192.168.1.106:61446 PA / Raw
1587148091.719291 Ether / IP / TCP 192.168.1.106:61446 > 9.9.9.9:https A
1587148091.720387 Ether / IP / TCP 192.168.1.106:61449 > 172.217.167.164:https S
1587148091.774020 Ether / IP / TCP 172.217.167.164:https > 192.168.1.106:61449 SA
1587148091.774108 Ether / IP / TCP 192.168.1.106:61449 > 172.217.167.164:https A
1587148091.776240 Ether / IP / TCP 192.168.1.106:61449 > 172.217.167.164:https PA / Raw
1587148091.826642 Ether / IP / TCP 172.217.167.164:https > 192.168.1.106:61449 A
1587148091.827463 Ether / IP / TCP 172.217.167.164:https > 192.168.1.106:61449 PA / Raw
1587148091.827532 Ether / IP / TCP 192.168.1.106:61449 > 172.217.167.164:https A
1587148091.828612 Ether / IP / TCP 192.168.1.106:61449 > 172.217.167.164:https PA / Raw
1587148091.830610 Ether / IP / TCP 192.168.1.106:61449 > 172.217.167.164:https PA / Raw
1587148091.830670 Ether / IP / TCP 192.168.1.106:61449 > 172.217.167.164:https PA / Raw
1587148091.881725 Ether / IP / TCP 172.217.167.164:https > 192.168.1.106:61449 A
1587148091.881729 Ether / IP / TCP 172.217.167.164:https > 192.168.1.106:61449 PA / Raw
1587148091.881810 Ether / IP / TCP 192.168.1.106:61449 > 172.217.167.164:https A
1587148091.881892 Ether / IP / TCP 172.217.167.164:https > 192.168.1.106:61449 PA / Raw
1587148091.881932 Ether / IP / TCP 192.168.1.106:61449 > 172.217.167.164:https A
1587148091.882246 Ether / IP / TCP 192.168.1.106:61449 > 172.217.167.164:https PA / Raw
1587148091.936890 Ether / IP / TCP 172.217.167.164:https > 192.168.1.106:61449 A
1587148092.033253 Ether / IP / TCP 172.217.167.164:https > 192.168.1.106:61449 PA / Raw
1587148092.033317 Ether / IP / TCP 192.168.1.106:61449 > 172.217.167.164:https A
1587148092.034323 Ether / IP / TCP 172.217.167.164:https > 192.168.1.106:61449 PA / Raw
1587148092.034327 Ether / IP / TCP 172.217.167.164:https > 192.168.1.106:61449 A / Raw
1587148092.034328 Ether / IP / TCP 172.217.167.164:https > 192.168.1.106:61449 A / Raw
1587148092.034383 Ether / IP / TCP 192.168.1.106:61449 > 172.217.167.164:https A
1587148092.034436 Ether / IP / TCP 192.168.1.106:61449 > 172.217.167.164:https A
1587148092.034478 Ether / IP / TCP 172.217.167.164:https > 192.168.1.106:61449 A / Raw
1587148092.034625 Ether / IP / TCP 192.168.1.106:61449 > 172.217.167.164:https A
1587148092.034707 Ether / IP / TCP 192.168.1.106:61449 > 172.217.167.164:https A
1587148092.035171 Ether / IP / TCP 172.217.167.164:https > 192.168.1.106:61449 A / Raw
1587148092.035173 Ether / IP / TCP 172.217.167.164:https > 192.168.1.106:61449 PA / Raw
1587148092.035221 Ether / IP / TCP 192.168.1.106:61449 > 172.217.167.164:https A
1587148092.093850 Ether / IP / TCP 172.217.167.164:https > 192.168.1.106:61449 PA / Raw
1587148092.093932 Ether / IP / TCP 192.168.1.106:61449 > 172.217.167.164:https A
1587148092.094353 Ether / IP / TCP 172.217.167.164:https > 192.168.1.106:61449 A / Raw
1587148092.094638 Ether / IP / TCP 172.217.167.164:https > 192.168.1.106:61449 PA / Raw
1587148092.094670 Ether / IP / TCP 192.168.1.106:61449 > 172.217.167.164:https A
1587148092.096996 Ether / IP / TCP 172.217.167.164:https > 192.168.1.106:61449 A / Raw
1587148092.097294 Ether / IP / TCP 172.217.167.164:https > 192.168.1.106:61449 A / Raw
1587148092.097351 Ether / IP / TCP 192.168.1.106:61449 > 172.217.167.164:https A
1587148092.097570 Ether / IP / TCP 192.168.1.106:61449 > 172.217.167.164:https A
1587148092.097971 Ether / IP / TCP 192.168.1.106:61449 > 172.217.167.164:https A
1587148092.099488 Ether / IP / TCP 172.217.167.164:https > 192.168.1.106:61449 A / Raw
1587148092.099913 Ether / IP / TCP 172.217.167.164:https > 192.168.1.106:61449 A / Raw
1587148092.099927 Ether / IP / TCP 192.168.1.106:61449 > 172.217.167.164:https A
1587148092.102250 Ether / IP / TCP 172.217.167.164:https > 192.168.1.106:61449 A / Raw
1587148092.102578 Ether / IP / TCP 192.168.1.106:61449 > 172.217.167.164:https A
1587148092.102704 Ether / IP / TCP 172.217.167.164:https > 192.168.1.106:61449 A / Raw
1587148092.103699 Ether / IP / TCP 192.168.1.106:61449 > 172.217.167.164:https A
1587148092.104880 Ether / IP / TCP 172.217.167.164:https > 192.168.1.106:61449 A / Raw
1587148092.108967 Ether / IP / TCP 172.217.167.164:https > 192.168.1.106:61449 A / Raw
1587148092.109035 Ether / IP / TCP 192.168.1.106:61449 > 172.217.167.164:https A
1587148092.109881 Ether / IP / TCP 172.217.167.164:https > 192.168.1.106:61449 A / Raw
1587148092.110795 Ether / IP / TCP 172.217.167.164:https > 192.168.1.106:61449 A / Raw
1587148092.110880 Ether / IP / TCP 192.168.1.106:61449 > 172.217.167.164:https A
1587148092.111840 Ether / IP / TCP 172.217.167.164:https > 192.168.1.106:61449 A / Raw
1587148092.111843 Ether / IP / TCP 172.217.167.164:https > 192.168.1.106:61449 A / Raw
1587148092.111889 Ether / IP / TCP 192.168.1.106:61449 > 172.217.167.164:https A
1587148092.112856 Ether / IP / TCP 172.217.167.164:https > 192.168.1.106:61449 A / Raw
1587148092.113156 Ether / IP / TCP 172.217.167.164:https > 192.168.1.106:61449 A / Raw
1587148092.113197 Ether / IP / TCP 192.168.1.106:61449 > 172.217.167.164:https A
1587148092.114951 Ether / IP / TCP 172.217.167.164:https > 192.168.1.106:61449 PA / Raw
1587148092.115204 Ether / IP / TCP 192.168.1.106:61449 > 172.217.167.164:https A
1587148092.117214 Ether / IP / TCP 192.168.1.106:61449 > 172.217.167.164:https A
1587148092.117396 Ether / IP / TCP 192.168.1.106:61449 > 172.217.167.164:https A
1587148092.150015 Ether / IP / TCP 172.217.167.164:https > 192.168.1.106:61449 A
1587148092.211501 Ether / IP / TCP 192.168.1.106:61449 > 172.217.167.164:https PA / Raw
1587148092.218203 Ether / IP / TCP 192.168.1.106:61449 > 172.217.167.164:https PA / Raw
1587148092.262850 Ether / IP / TCP 172.217.167.164:https > 192.168.1.106:61449 A
1587148092.270283 Ether / IP / TCP 172.217.167.164:https > 192.168.1.106:61449 A
1587148092.436398 Ether / IP / TCP 172.217.167.164:https > 192.168.1.106:61449 PA / Raw
1587148092.436462 Ether / IP / TCP 192.168.1.106:61449 > 172.217.167.164:https A
1587148092.436895 Ether / IP / TCP 172.217.167.164:https > 192.168.1.106:61449 A / Raw
1587148092.437508 Ether / IP / TCP 172.217.167.164:https > 192.168.1.106:61449 PA / Raw
1587148092.437545 Ether / IP / TCP 192.168.1.106:61449 > 172.217.167.164:https A
1587148092.439738 Ether / IP / TCP 172.217.167.164:https > 192.168.1.106:61449 PA / Raw
1587148092.439789 Ether / IP / TCP 192.168.1.106:61449 > 172.217.167.164:https A
1587148092.441164 Ether / IP / TCP 172.217.167.164:https > 192.168.1.106:61449 PA / Raw
1587148092.441213 Ether / IP / TCP 192.168.1.106:61449 > 172.217.167.164:https A
1587148092.442806 Ether / IP / TCP 172.217.167.164:https > 192.168.1.106:61449 A / Raw
1587148092.442821 Ether / IP / TCP 172.217.167.164:https > 192.168.1.106:61449 PA / Raw
1587148092.442902 Ether / IP / TCP 192.168.1.106:61449 > 172.217.167.164:https A
1587148092.444484 Ether / IP / TCP 172.217.167.164:https > 192.168.1.106:61449 PA / Raw
1587148092.444532 Ether / IP / TCP 192.168.1.106:61449 > 172.217.167.164:https A
1587148092.444697 Ether / IP / TCP 192.168.1.106:61449 > 172.217.167.164:https A
1587148092.444795 Ether / IP / TCP 192.168.1.106:61449 > 172.217.167.164:https A
1587148092.456649 Ether / IP / TCP 172.217.167.164:https > 192.168.1.106:61449 PA / Raw
1587148092.456715 Ether / IP / TCP 192.168.1.106:61449 > 172.217.167.164:https A
1587148092.456909 Ether / IP / TCP 172.217.167.164:https > 192.168.1.106:61449 A / Raw
1587148092.456911 Ether / IP / TCP 172.217.167.164:https > 192.168.1.106:61449 PA / Raw
1587148092.456943 Ether / IP / TCP 192.168.1.106:61449 > 172.217.167.164:https A
1587148092.457090 Ether / IP / TCP 192.168.1.106:61449 > 172.217.167.164:https A
1587148092.459291 Ether / IP / TCP 172.217.167.164:https > 192.168.1.106:61449 A / Raw
1587148092.459661 Ether / IP / TCP 172.217.167.164:https > 192.168.1.106:61449 A / Raw
1587148092.459701 Ether / IP / TCP 192.168.1.106:61449 > 172.217.167.164:https A
1587148092.461906 Ether / IP / TCP 172.217.167.164:https > 192.168.1.106:61449 A / Raw
1587148092.462142 Ether / IP / TCP 192.168.1.106:61449 > 172.217.167.164:https A
1587148092.462456 Ether / IP / TCP 172.217.167.164:https > 192.168.1.106:61449 A / Raw
1587148092.464642 Ether / IP / TCP 172.217.167.164:https > 192.168.1.106:61449 A / Raw
1587148092.464697 Ether / IP / TCP 192.168.1.106:61449 > 172.217.167.164:https A
1587148092.467662 Ether / IP / TCP 172.217.167.164:https > 192.168.1.106:61449 A / Raw
1587148092.467666 Ether / IP / TCP 172.217.167.164:https > 192.168.1.106:61449 A / Raw
1587148092.467714 Ether / IP / TCP 192.168.1.106:61449 > 172.217.167.164:https A
1587148092.467760 Ether / IP / TCP 172.217.167.164:https > 192.168.1.106:61449 A / Raw
1587148092.468105 Ether / IP / TCP 192.168.1.106:61449 > 172.217.167.164:https A
1587148092.469769 Ether / IP / TCP 172.217.167.164:https > 192.168.1.106:61449 A / Raw
1587148092.470101 Ether / IP / TCP 172.217.167.164:https > 192.168.1.106:61449 A / Raw
1587148092.470132 Ether / IP / TCP 192.168.1.106:61449 > 172.217.167.164:https A
1587148092.472427 Ether / IP / TCP 172.217.167.164:https > 192.168.1.106:61449 A / Raw
1587148092.472594 Ether / IP / TCP 192.168.1.106:61449 > 172.217.167.164:https A
1587148092.472692 Ether / IP / TCP 172.217.167.164:https > 192.168.1.106:61449 A / Raw
1587148092.475234 Ether / IP / TCP 172.217.167.164:https > 192.168.1.106:61449 A / Raw
1587148092.475285 Ether / IP / TCP 192.168.1.106:61449 > 172.217.167.164:https A
1587148092.475417 Ether / IP / TCP 172.217.167.164:https > 192.168.1.106:61449 A / Raw
1587148092.477936 Ether / IP / TCP 172.217.167.164:https > 192.168.1.106:61449 A / Raw
1587148092.477939 Ether / IP / TCP 172.217.167.164:https > 192.168.1.106:61449 A / Raw
1587148092.478002 Ether / IP / TCP 192.168.1.106:61449 > 172.217.167.164:https A
1587148092.480296 Ether / IP / TCP 172.217.167.164:https > 192.168.1.106:61449 A / Raw
1587148092.480338 Ether / IP / TCP 192.168.1.106:61449 > 172.217.167.164:https A
1587148092.481614 Ether / IP / TCP 172.217.167.164:https > 192.168.1.106:61449 A / Raw
1587148092.483029 Ether / IP / TCP 172.217.167.164:https > 192.168.1.106:61449 A / Raw
1587148092.483072 Ether / IP / TCP 192.168.1.106:61449 > 172.217.167.164:https A
1587148092.483163 Ether / IP / TCP 172.217.167.164:https > 192.168.1.106:61449 PA / Raw
1587148092.483195 Ether / IP / TCP 192.168.1.106:61449 > 172.217.167.164:https A
1587148092.490719 Ether / IP / TCP 192.168.1.106:61449 > 172.217.167.164:https A
1587148092.490777 Ether / IP / TCP 192.168.1.106:61449 > 172.217.167.164:https A
1587148092.490815 Ether / IP / TCP 192.168.1.106:61449 > 172.217.167.164:https A
1587148092.507912 Ether / IP / TCP 172.217.167.164:https > 192.168.1.106:61449 PA / Raw
1587148092.508058 Ether / IP / TCP 192.168.1.106:61449 > 172.217.167.164:https A
1587148092.508211 Ether / IP / TCP 172.217.167.164:https > 192.168.1.106:61449 A / Raw
1587148092.508213 Ether / IP / TCP 172.217.167.164:https > 192.168.1.106:61449 PA / Raw
1587148092.508247 Ether / IP / TCP 192.168.1.106:61449 > 172.217.167.164:https A
1587148092.511042 Ether / IP / TCP 172.217.167.164:https > 192.168.1.106:61449 A / Raw
1587148092.511046 Ether / IP / TCP 172.217.167.164:https > 192.168.1.106:61449 A / Raw
1587148092.511089 Ether / IP / TCP 192.168.1.106:61449 > 172.217.167.164:https A
1587148092.512055 Ether / IP / TCP 192.168.1.106:61449 > 172.217.167.164:https A
1587148092.514282 Ether / IP / TCP 192.168.1.106:61449 > 172.217.167.164:https A
1587148092.526127 Ether / IP / TCP 172.217.167.164:https > 192.168.1.106:61449 A / Raw
1587148092.527231 Ether / IP / TCP 192.168.1.106:61449 > 172.217.167.164:https A
1587148092.527986 Ether / IP / TCP 172.217.167.164:https > 192.168.1.106:61449 A / Raw
1587148092.530705 Ether / IP / TCP 172.217.167.164:https > 192.168.1.106:61449 A / Raw
1587148092.530708 Ether / IP / TCP 172.217.167.164:https > 192.168.1.106:61449 A / Raw
1587148092.530765 Ether / IP / TCP 192.168.1.106:61449 > 172.217.167.164:https A
1587148092.530824 Ether / IP / TCP 172.217.167.164:https > 192.168.1.106:61449 A / Raw
1587148092.530826 Ether / IP / TCP 172.217.167.164:https > 192.168.1.106:61449 PA / Raw
1587148092.530853 Ether / IP / TCP 192.168.1.106:61449 > 172.217.167.164:https A
1587148092.530853 Ether / IP / TCP 192.168.1.106:61449 > 172.217.167.164:https A
1587148092.530932 Ether / IP / TCP 172.217.167.164:https > 192.168.1.106:61449 PA / Raw
1587148092.530950 Ether / IP / TCP 192.168.1.106:61449 > 172.217.167.164:https A
1587148092.531135 Ether / IP / TCP 172.217.167.164:https > 192.168.1.106:61449 A / Raw
1587148092.531138 Ether / IP / TCP 172.217.167.164:https > 192.168.1.106:61449 PA / Raw
1587148092.531138 Ether / IP / TCP 172.217.167.164:https > 192.168.1.106:61449 PA / Raw
1587148092.531161 Ether / IP / TCP 192.168.1.106:61449 > 172.217.167.164:https A
1587148092.531161 Ether / IP / TCP 192.168.1.106:61449 > 172.217.167.164:https A
1587148092.531734 Ether / IP / TCP 192.168.1.106:61449 > 172.217.167.164:https A
1587148092.531796 Ether / IP / TCP 192.168.1.106:61449 > 172.217.167.164:https A
1587148092.532108 Ether / IP / TCP 192.168.1.106:61449 > 172.217.167.164:https PA / Raw
1587148092.579155 Ether / IP / TCP 172.217.167.164:https > 192.168.1.106:61449 A
1587148092.642082 Ether / IP / TCP 192.168.1.106:61449 > 172.217.167.164:https PA / Raw
1587148092.692132 Ether / IP / TCP 172.217.167.164:https > 192.168.1.106:61449 A
1587148092.694299 Ether / IP / TCP 172.217.167.164:https > 192.168.1.106:61449 PA / Raw
1587148092.694301 Ether / IP / TCP 172.217.167.164:https > 192.168.1.106:61449 PA / Raw
1587148092.694351 Ether / IP / TCP 192.168.1.106:61449 > 172.217.167.164:https A
1587148092.694351 Ether / IP / TCP 192.168.1.106:61449 > 172.217.167.164:https A
1587148092.695539 Ether / IP / TCP 172.217.167.164:https > 192.168.1.106:61449 A / Raw
1587148092.695543 Ether / IP / TCP 172.217.167.164:https > 192.168.1.106:61449 A / Raw
1587148092.695593 Ether / IP / TCP 192.168.1.106:61449 > 172.217.167.164:https A
1587148092.695771 Ether / IP / TCP 192.168.1.106:61449 > 172.217.167.164:https A
1587148092.696568 Ether / IP / TCP 172.217.167.164:https > 192.168.1.106:61449 A / Raw
1587148092.696571 Ether / IP / TCP 172.217.167.164:https > 192.168.1.106:61449 A / Raw
1587148092.696613 Ether / IP / TCP 192.168.1.106:61449 > 172.217.167.164:https A
1587148092.696745 Ether / IP / TCP 192.168.1.106:61449 > 172.217.167.164:https A
1587148092.698177 Ether / IP / TCP 172.217.167.164:https > 192.168.1.106:61449 A / Raw
1587148092.698599 Ether / IP / TCP 172.217.167.164:https > 192.168.1.106:61449 A / Raw
1587148092.698659 Ether / IP / TCP 192.168.1.106:61449 > 172.217.167.164:https A
1587148092.699734 Ether / IP / TCP 172.217.167.164:https > 192.168.1.106:61449 A / Raw
1587148092.699738 Ether / IP / TCP 172.217.167.164:https > 192.168.1.106:61449 A / Raw
1587148092.699826 Ether / IP / TCP 192.168.1.106:61449 > 172.217.167.164:https A
1587148092.699994 Ether / IP / TCP 192.168.1.106:61449 > 172.217.167.164:https A
1587148092.701252 Ether / IP / TCP 172.217.167.164:https > 192.168.1.106:61449 A / Raw
1587148092.701700 Ether / IP / TCP 172.217.167.164:https > 192.168.1.106:61449 A / Raw
1587148092.701737 Ether / IP / TCP 192.168.1.106:61449 > 172.217.167.164:https A
1587148092.702986 Ether / IP / TCP 172.217.167.164:https > 192.168.1.106:61449 A / Raw
1587148092.703415 Ether / IP / TCP 172.217.167.164:https > 192.168.1.106:61449 A / Raw
1587148092.703455 Ether / IP / TCP 192.168.1.106:61449 > 172.217.167.164:https A
1587148092.704667 Ether / IP / TCP 172.217.167.164:https > 192.168.1.106:61449 A / Raw
1587148092.704670 Ether / IP / TCP 172.217.167.164:https > 192.168.1.106:61449 A / Raw
1587148092.704723 Ether / IP / TCP 192.168.1.106:61449 > 172.217.167.164:https A
1587148092.704913 Ether / IP / TCP 192.168.1.106:61449 > 172.217.167.164:https A
1587148092.706008 Ether / IP / TCP 172.217.167.164:https > 192.168.1.106:61449 A / Raw
1587148092.706301 Ether / IP / TCP 192.168.1.106:61449 > 172.217.167.164:https A
1587148092.706369 Ether / IP / TCP 172.217.167.164:https > 192.168.1.106:61449 A / Raw
1587148092.707602 Ether / IP / TCP 172.217.167.164:https > 192.168.1.106:61449 A / Raw
1587148092.707647 Ether / IP / TCP 192.168.1.106:61449 > 172.217.167.164:https A
1587148092.708726 Ether / IP / TCP 172.217.167.164:https > 192.168.1.106:61449 A / Raw
1587148092.709208 Ether / IP / TCP 172.217.167.164:https > 192.168.1.106:61449 A / Raw
1587148092.709328 Ether / IP / TCP 192.168.1.106:61449 > 172.217.167.164:https A
1587148092.709770 Ether / IP / TCP 172.217.167.164:https > 192.168.1.106:61449 A / Raw
1587148092.710260 Ether / IP / TCP 192.168.1.106:61449 > 172.217.167.164:https A
1587148092.711069 Ether / IP / TCP 172.217.167.164:https > 192.168.1.106:61449 A / Raw
1587148092.711071 Ether / IP / TCP 172.217.167.164:https > 192.168.1.106:61449 A / Raw
1587148092.711112 Ether / IP / TCP 192.168.1.106:61449 > 172.217.167.164:https A
1587148092.712401 Ether / IP / TCP 172.217.167.164:https > 192.168.1.106:61449 A / Raw
1587148092.713022 Ether / IP / TCP 172.217.167.164:https > 192.168.1.106:61449 A / Raw
1587148092.713055 Ether / IP / TCP 192.168.1.106:61449 > 172.217.167.164:https A
1587148092.714072 Ether / IP / TCP 172.217.167.164:https > 192.168.1.106:61449 A / Raw
1587148092.714406 Ether / IP / TCP 172.217.167.164:https > 192.168.1.106:61449 A / Raw
1587148092.714438 Ether / IP / TCP 192.168.1.106:61449 > 172.217.167.164:https A
1587148092.715603 Ether / IP / TCP 172.217.167.164:https > 192.168.1.106:61449 A / Raw
1587148092.716063 Ether / IP / TCP 172.217.167.164:https > 192.168.1.106:61449 A / Raw
1587148092.716101 Ether / IP / TCP 192.168.1.106:61449 > 172.217.167.164:https A
1587148092.717344 Ether / IP / TCP 172.217.167.164:https > 192.168.1.106:61449 A / Raw
1587148092.717780 Ether / IP / TCP 172.217.167.164:https > 192.168.1.106:61449 A / Raw
1587148092.717811 Ether / IP / TCP 192.168.1.106:61449 > 172.217.167.164:https A
1587148092.718818 Ether / IP / TCP 172.217.167.164:https > 192.168.1.106:61449 A / Raw
1587148092.719199 Ether / IP / TCP 172.217.167.164:https > 192.168.1.106:61449 A / Raw
1587148092.719228 Ether / IP / TCP 192.168.1.106:61449 > 172.217.167.164:https A
1587148092.720411 Ether / IP / TCP 172.217.167.164:https > 192.168.1.106:61449 A / Raw
1587148092.720762 Ether / IP / TCP 172.217.167.164:https > 192.168.1.106:61449 A / Raw
1587148092.720776 Ether / IP / TCP 192.168.1.106:61449 > 172.217.167.164:https A
1587148092.722030 Ether / IP / TCP 172.217.167.164:https > 192.168.1.106:61449 A / Raw
1587148092.722072 Ether / IP / TCP 192.168.1.106:61449 > 172.217.167.164:https A
1587148092.722572 Ether / IP / TCP 172.217.167.164:https > 192.168.1.106:61449 A / Raw
1587148092.723681 Ether / IP / TCP 172.217.167.164:https > 192.168.1.106:61449 A / Raw
1587148092.723721 Ether / IP / TCP 192.168.1.106:61449 > 172.217.167.164:https A
1587148092.724142 Ether / IP / TCP 172.217.167.164:https > 192.168.1.106:61449 A / Raw
1587148092.724789 Ether / IP / TCP 192.168.1.106:61449 > 172.217.167.164:https A
1587148092.725251 Ether / IP / TCP 172.217.167.164:https > 192.168.1.106:61449 A / Raw
1587148092.725554 Ether / IP / TCP 192.168.1.106:61449 > 172.217.167.164:https A
1587148092.725665 Ether / IP / TCP 192.168.1.106:61449 > 172.217.167.164:https A
1587148092.725715 Ether / IP / TCP 192.168.1.106:61449 > 172.217.167.164:https A
1587148092.725726 Ether / IP / TCP 192.168.1.106:61449 > 172.217.167.164:https A
1587148092.725759 Ether / IP / TCP 192.168.1.106:61449 > 172.217.167.164:https A
1587148092.725804 Ether / IP / TCP 192.168.1.106:61449 > 172.217.167.164:https A
1587148092.725850 Ether / IP / TCP 192.168.1.106:61449 > 172.217.167.164:https A
1587148092.727238 Ether / IP / TCP 172.217.167.164:https > 192.168.1.106:61449 A / Raw
1587148092.727241 Ether / IP / TCP 172.217.167.164:https > 192.168.1.106:61449 A / Raw
1587148092.727283 Ether / IP / TCP 192.168.1.106:61449 > 172.217.167.164:https A
1587148092.727337 Ether / IP / TCP 172.217.167.164:https > 192.168.1.106:61449 A / Raw
1587148092.727653 Ether / IP / TCP 192.168.1.106:61449 > 172.217.167.164:https A
1587148092.728427 Ether / IP / TCP 172.217.167.164:https > 192.168.1.106:61449 A / Raw
1587148092.728889 Ether / IP / TCP 172.217.167.164:https > 192.168.1.106:61449 A / Raw
1587148092.728924 Ether / IP / TCP 192.168.1.106:61449 > 172.217.167.164:https A
1587148092.729231 Ether / IP / TCP 192.168.1.106:61449 > 172.217.167.164:https A
1587148092.730011 Ether / IP / TCP 172.217.167.164:https > 192.168.1.106:61449 A / Raw
1587148092.730364 Ether / IP / TCP 172.217.167.164:https > 192.168.1.106:61449 A / Raw
1587148092.730397 Ether / IP / TCP 192.168.1.106:61449 > 172.217.167.164:https A
1587148092.733615 Ether / IP / TCP 172.217.167.164:https > 192.168.1.106:61449 A / Raw
1587148092.733618 Ether / IP / TCP 172.217.167.164:https > 192.168.1.106:61449 A / Raw
1587148092.733666 Ether / IP / TCP 192.168.1.106:61449 > 172.217.167.164:https A
1587148092.733709 Ether / IP / TCP 172.217.167.164:https > 192.168.1.106:61449 A / Raw
1587148092.733854 Ether / IP / TCP 172.217.167.164:https > 192.168.1.106:61449 A / Raw
1587148092.733870 Ether / IP / TCP 192.168.1.106:61449 > 172.217.167.164:https A
1587148092.734385 Ether / IP / TCP 192.168.1.106:61449 > 172.217.167.164:https A
1587148092.734868 Ether / IP / TCP 172.217.167.164:https > 192.168.1.106:61449 A / Raw
1587148092.735174 Ether / IP / TCP 192.168.1.106:61449 > 172.217.167.164:https A
1587148092.736298 Ether / IP / TCP 172.217.167.164:https > 192.168.1.106:61449 A / Raw
1587148092.736817 Ether / IP / TCP 172.217.167.164:https > 192.168.1.106:61449 A / Raw
1587148092.736820 Ether / IP / TCP 172.217.167.164:https > 192.168.1.106:61449 A / Raw
1587148092.736856 Ether / IP / TCP 192.168.1.106:61449 > 172.217.167.164:https A
1587148092.738012 Ether / IP / TCP 172.217.167.164:https > 192.168.1.106:61449 A / Raw
1587148092.738051 Ether / IP / TCP 192.168.1.106:61449 > 172.217.167.164:https A
1587148092.738417 Ether / IP / TCP 172.217.167.164:https > 192.168.1.106:61449 A / Raw
1587148092.739665 Ether / IP / TCP 172.217.167.164:https > 192.168.1.106:61449 A / Raw
1587148092.739715 Ether / IP / TCP 192.168.1.106:61449 > 172.217.167.164:https A
1587148092.740207 Ether / IP / TCP 172.217.167.164:https > 192.168.1.106:61449 A / Raw
1587148092.741703 Ether / IP / TCP 172.217.167.164:https > 192.168.1.106:61449 A / Raw
1587148092.741706 Ether / IP / TCP 172.217.167.164:https > 192.168.1.106:61449 A / Raw
1587148092.741756 Ether / IP / TCP 192.168.1.106:61449 > 172.217.167.164:https A
1587148092.742424 Ether / IP / TCP 192.168.1.106:61449 > 172.217.167.164:https A
1587148092.742594 Ether / IP / TCP 192.168.1.106:61449 > 172.217.167.164:https A
1587148092.742955 Ether / IP / TCP 192.168.1.106:61449 > 172.217.167.164:https A
1587148092.743534 Ether / IP / TCP 172.217.167.164:https > 192.168.1.106:61449 A / Raw
1587148092.743537 Ether / IP / TCP 172.217.167.164:https > 192.168.1.106:61449 A / Raw
1587148092.743586 Ether / IP / TCP 192.168.1.106:61449 > 172.217.167.164:https A
1587148092.743863 Ether / IP / TCP 192.168.1.106:61449 > 172.217.167.164:https A
1587148092.744725 Ether / IP / TCP 172.217.167.164:https > 192.168.1.106:61449 A / Raw
1587148092.744727 Ether / IP / TCP 172.217.167.164:https > 192.168.1.106:61449 A / Raw
1587148092.744768 Ether / IP / TCP 192.168.1.106:61449 > 172.217.167.164:https A
1587148092.745095 Ether / IP / TCP 192.168.1.106:61449 > 172.217.167.164:https A
1587148092.746036 Ether / IP / TCP 172.217.167.164:https > 192.168.1.106:61449 A / Raw
1587148092.747750 Ether / IP / TCP 172.217.167.164:https > 192.168.1.106:61449 A / Raw
1587148092.747793 Ether / IP / TCP 192.168.1.106:61449 > 172.217.167.164:https A
1587148092.748162 Ether / IP / TCP 172.217.167.164:https > 192.168.1.106:61449 A / Raw
1587148092.748163 Ether / IP / TCP 172.217.167.164:https > 192.168.1.106:61449 A / Raw
1587148092.748192 Ether / IP / TCP 192.168.1.106:61449 > 172.217.167.164:https A
1587148092.749375 Ether / IP / TCP 172.217.167.164:https > 192.168.1.106:61449 A / Raw
1587148092.749377 Ether / IP / TCP 172.217.167.164:https > 192.168.1.106:61449 A / Raw
1587148092.749413 Ether / IP / TCP 192.168.1.106:61449 > 172.217.167.164:https A
1587148092.750870 Ether / IP / TCP 172.217.167.164:https > 192.168.1.106:61449 A / Raw
1587148092.751282 Ether / IP / TCP 172.217.167.164:https > 192.168.1.106:61449 A / Raw
1587148092.751314 Ether / IP / TCP 192.168.1.106:61449 > 172.217.167.164:https A
1587148092.752489 Ether / IP / TCP 172.217.167.164:https > 192.168.1.106:61449 A / Raw
1587148092.752787 Ether / IP / TCP 172.217.167.164:https > 192.168.1.106:61449 A / Raw
1587148092.752818 Ether / IP / TCP 192.168.1.106:61449 > 172.217.167.164:https A
1587148092.754090 Ether / IP / TCP 172.217.167.164:https > 192.168.1.106:61449 A / Raw
1587148092.754779 Ether / IP / TCP 172.217.167.164:https > 192.168.1.106:61449 A / Raw
1587148092.754812 Ether / IP / TCP 192.168.1.106:61449 > 172.217.167.164:https A
1587148092.755634 Ether / IP / TCP 172.217.167.164:https > 192.168.1.106:61449 A / Raw
1587148092.755986 Ether / IP / TCP 172.217.167.164:https > 192.168.1.106:61449 A / Raw
1587148092.756023 Ether / IP / TCP 192.168.1.106:61449 > 172.217.167.164:https A
1587148092.757295 Ether / IP / TCP 172.217.167.164:https > 192.168.1.106:61449 A / Raw
1587148092.757575 Ether / IP / TCP 172.217.167.164:https > 192.168.1.106:61449 A / Raw
1587148092.757619 Ether / IP / TCP 192.168.1.106:61449 > 172.217.167.164:https A
1587148092.758877 Ether / IP / TCP 172.217.167.164:https > 192.168.1.106:61449 A / Raw
1587148092.759354 Ether / IP / TCP 172.217.167.164:https > 192.168.1.106:61449 A / Raw
1587148092.759402 Ether / IP / TCP 192.168.1.106:61449 > 172.217.167.164:https A
1587148092.760433 Ether / IP / TCP 172.217.167.164:https > 192.168.1.106:61449 A / Raw
1587148092.761041 Ether / IP / TCP 172.217.167.164:https > 192.168.1.106:61449 A / Raw
1587148092.761081 Ether / IP / TCP 192.168.1.106:61449 > 172.217.167.164:https A
1587148092.762641 Ether / IP / TCP 172.217.167.164:https > 192.168.1.106:61449 A / Raw
1587148092.762644 Ether / IP / TCP 172.217.167.164:https > 192.168.1.106:61449 A / Raw
1587148092.762682 Ether / IP / TCP 192.168.1.106:61449 > 172.217.167.164:https A
1587148092.763899 Ether / IP / TCP 172.217.167.164:https > 192.168.1.106:61449 A / Raw
1587148092.763904 Ether / IP / TCP 172.217.167.164:https > 192.168.1.106:61449 A / Raw
1587148092.763953 Ether / IP / TCP 192.168.1.106:61449 > 172.217.167.164:https A
1587148092.765278 Ether / IP / TCP 172.217.167.164:https > 192.168.1.106:61449 A / Raw
1587148092.765738 Ether / IP / TCP 172.217.167.164:https > 192.168.1.106:61449 A / Raw
1587148092.765776 Ether / IP / TCP 192.168.1.106:61449 > 172.217.167.164:https A
1587148092.766844 Ether / IP / TCP 172.217.167.164:https > 192.168.1.106:61449 A / Raw
1587148092.767214 Ether / IP / TCP 172.217.167.164:https > 192.168.1.106:61449 A / Raw
1587148092.767260 Ether / IP / TCP 192.168.1.106:61449 > 172.217.167.164:https A
1587148092.768483 Ether / IP / TCP 172.217.167.164:https > 192.168.1.106:61449 A / Raw
1587148092.768871 Ether / IP / TCP 172.217.167.164:https > 192.168.1.106:61449 A / Raw
1587148092.768904 Ether / IP / TCP 192.168.1.106:61449 > 172.217.167.164:https A
1587148092.769486 Ether / IP / TCP 192.168.1.106:61449 > 172.217.167.164:https A
1587148092.769536 Ether / IP / TCP 192.168.1.106:61449 > 172.217.167.164:https A
1587148092.769572 Ether / IP / TCP 192.168.1.106:61449 > 172.217.167.164:https A
1587148092.769604 Ether / IP / TCP 192.168.1.106:61449 > 172.217.167.164:https A
1587148092.769638 Ether / IP / TCP 192.168.1.106:61449 > 172.217.167.164:https A
1587148092.769669 Ether / IP / TCP 192.168.1.106:61449 > 172.217.167.164:https A
1587148092.769699 Ether / IP / TCP 192.168.1.106:61449 > 172.217.167.164:https A
1587148092.769730 Ether / IP / TCP 192.168.1.106:61449 > 172.217.167.164:https A
1587148092.769766 Ether / IP / TCP 192.168.1.106:61449 > 172.217.167.164:https A
1587148092.769798 Ether / IP / TCP 192.168.1.106:61449 > 172.217.167.164:https A
1587148092.769877 Ether / IP / TCP 192.168.1.106:61449 > 172.217.167.164:https A
1587148092.769877 Ether / IP / TCP 192.168.1.106:61449 > 172.217.167.164:https A
1587148092.769905 Ether / IP / TCP 192.168.1.106:61449 > 172.217.167.164:https A
1587148092.770349 Ether / IP / TCP 172.217.167.164:https > 192.168.1.106:61449 A / Raw
1587148092.770351 Ether / IP / TCP 172.217.167.164:https > 192.168.1.106:61449 A / Raw
1587148092.770390 Ether / IP / TCP 192.168.1.106:61449 > 172.217.167.164:https A
1587148092.771533 Ether / IP / TCP 192.168.1.106:61449 > 172.217.167.164:https A
1587148092.771633 Ether / IP / TCP 172.217.167.164:https > 192.168.1.106:61449 A / Raw
1587148092.773204 Ether / IP / TCP 172.217.167.164:https > 192.168.1.106:61449 A / Raw
1587148092.773249 Ether / IP / TCP 192.168.1.106:61449 > 172.217.167.164:https A
1587148092.774831 Ether / IP / TCP 172.217.167.164:https > 192.168.1.106:61449 A / Raw
1587148092.774834 Ether / IP / TCP 172.217.167.164:https > 192.168.1.106:61449 A / Raw
1587148092.774882 Ether / IP / TCP 192.168.1.106:61449 > 172.217.167.164:https A
1587148092.774929 Ether / IP / TCP 172.217.167.164:https > 192.168.1.106:61449 A / Raw
1587148092.775064 Ether / IP / TCP 172.217.167.164:https > 192.168.1.106:61449 A / Raw
1587148092.775089 Ether / IP / TCP 192.168.1.106:61449 > 172.217.167.164:https A
1587148092.776052 Ether / IP / TCP 172.217.167.164:https > 192.168.1.106:61449 A / Raw
1587148092.776108 Ether / IP / TCP 192.168.1.106:61449 > 172.217.167.164:https A
1587148092.776160 Ether / IP / TCP 192.168.1.106:61449 > 172.217.167.164:https A
1587148092.776364 Ether / IP / TCP 172.217.167.164:https > 192.168.1.106:61449 A / Raw
1587148092.777523 Ether / IP / TCP 172.217.167.164:https > 192.168.1.106:61449 A / Raw
1587148092.777566 Ether / IP / TCP 192.168.1.106:61449 > 172.217.167.164:https A
1587148092.777914 Ether / IP / TCP 172.217.167.164:https > 192.168.1.106:61449 A / Raw
1587148092.778126 Ether / IP / TCP 192.168.1.106:61449 > 172.217.167.164:https A
1587148092.779498 Ether / IP / TCP 172.217.167.164:https > 192.168.1.106:61449 A / Raw
1587148092.779502 Ether / IP / TCP 172.217.167.164:https > 192.168.1.106:61449 A / Raw
1587148092.779546 Ether / IP / TCP 192.168.1.106:61449 > 172.217.167.164:https A
1587148092.779785 Ether / IP / TCP 192.168.1.106:61449 > 172.217.167.164:https A
1587148092.780612 Ether / IP / TCP 172.217.167.164:https > 192.168.1.106:61449 A / Raw
1587148092.780615 Ether / IP / TCP 172.217.167.164:https > 192.168.1.106:61449 A / Raw
1587148092.780657 Ether / IP / TCP 192.168.1.106:61449 > 172.217.167.164:https A
1587148092.780883 Ether / IP / TCP 192.168.1.106:61449 > 172.217.167.164:https A
1587148092.781783 Ether / IP / TCP 172.217.167.164:https > 192.168.1.106:61449 A / Raw
1587148092.781785 Ether / IP / TCP 172.217.167.164:https > 192.168.1.106:61449 A / Raw
1587148092.781825 Ether / IP / TCP 192.168.1.106:61449 > 172.217.167.164:https A
