1587134743.837364 Ether / IP / TCP 111.221.29.254:https > 192.168.1.106:58088 PA / Raw
1587134743.837455 Ether / IP / TCP 192.168.1.106:58088 > 111.221.29.254:https A
1587134743.839097 Ether / IP / TCP 192.168.1.106:58088 > 111.221.29.254:https PA / Raw
1587134744.052138 Ether / IP / TCP 111.221.29.254:https > 192.168.1.106:58088 A
1587134744.140799 Ether / IP / TCP 111.221.29.254:https > 192.168.1.106:58088 FPA / Raw
1587134744.140853 Ether / IP / TCP 192.168.1.106:58088 > 111.221.29.254:https A
1587134744.141766 Ether / IP / TCP 192.168.1.106:58088 > 111.221.29.254:https PA / Raw
1587134744.141934 Ether / IP / TCP 192.168.1.106:58088 > 111.221.29.254:https FA
1587134744.295385 Ether / IP / TCP 111.221.29.254:https > 192.168.1.106:58088 A
1587134745.396663 Ether / IP / TCP 192.168.1.106:58089 > 192.168.1.254:8013 S
1587134745.398177 Ether / IP / TCP 192.168.1.254:8013 > 192.168.1.106:58089 RA
1587134745.410323 Ether / ARP who has 169.254.1.1 says 192.168.1.106
1587134746.413025 Ether / ARP who has 169.254.1.1 says 192.168.1.106
1587134748.107831 Ether / IP / TCP 192.168.1.106:58005 > 17.57.145.8:5223 FPA / Raw
1587134748.894874 Ether / ARP who has 192.168.1.106 says 192.168.1.254 / Padding
1587134748.894885 Ether / ARP is at 8c:85:90:b2:22:b5 says 192.168.1.106
1587134749.425588 Ether / IP / TCP 9.9.9.9:https > 192.168.1.106:58082 PA / Raw
1587134749.425591 Ether / IP / TCP 9.9.9.9:https > 192.168.1.106:58082 FA
1587134749.425632 Ether / IP / TCP 192.168.1.106:58082 > 9.9.9.9:https A
1587134749.425662 Ether / IP / TCP 192.168.1.106:58082 > 9.9.9.9:https A
1587134749.426023 Ether / IP / TCP 192.168.1.106:58082 > 9.9.9.9:https PA / Raw
1587134749.426412 Ether / IP / TCP 192.168.1.106:58082 > 9.9.9.9:https PA / Raw
1587134749.42646 Ether / IP / TCP 192.168.1.106:58082 > 9.9.9.9:https FA
1587134749.437339 Ether / IP / TCP 9.9.9.9:https > 192.168.1.106:58082 R
1587134749.437342 Ether / IP / TCP 9.9.9.9:https > 192.168.1.106:58082 R
1587134749.437709 Ether / IP / TCP 9.9.9.9:https > 192.168.1.106:58082 R
1587134750.494956 Ether / IP / TCP 54.192.151.2:https > 192.168.1.106:58083 A
1587134750.494987 Ether / IP / TCP 192.168.1.106:58083 > 54.192.151.2:https A
1587134750.5929 Ether / IP / TCP 54.192.151.2:https > 192.168.1.106:58083 A
1587134752.963948 Ether / IP / UDP / DNS Qry "b'gitlab.com.'" 
1587134752.975973 Ether / IP / UDP / DNS Ans "172.65.251.78" 
1587134752.976706 Ether / IP / ICMP 192.168.1.106 > 172.65.251.78 echo-request 0 / Raw
1587134752.990946 Ether / IP / ICMP 172.65.251.78 > 192.168.1.106 echo-reply 0 / Raw
1587134753.870933 Ether / ARP who has 192.168.1.106 says 192.168.1.254 / Padding
1587134753.870944 Ether / ARP is at 8c:85:90:b2:22:b5 says 192.168.1.106
1587134754.321471 Ether / IP / TCP 192.168.1.106:58029 > 13.69.68.34:https A
1587134756.798971 Ether / IP / TCP 192.168.1.106:58040 > 51.144.164.215:https A
1587134758.400328 Ether / IP / TCP 140.82.114.25:https > 192.168.1.106:57754 A
1587134758.400368 Ether / IP / TCP 192.168.1.106:57754 > 140.82.114.25:https A
1587134758.643391 Ether / IP / TCP 140.82.114.25:https > 192.168.1.106:57754 A
1587134758.921698 Ether / ARP who has 192.168.1.106 says 192.168.1.254 / Padding
1587134758.921711 Ether / ARP is at 8c:85:90:b2:22:b5 says 192.168.1.106
1587134759.122713 Ether / IP / UDP / DNS Qry "b'github.com.'" 
1587134759.135766 Ether / IP / UDP / DNS Ans "140.82.112.3" 
1587134759.136469 Ether / IP / ICMP 192.168.1.106 > 140.82.112.3 echo-request 0 / Raw
1587134759.260642 Ether / IP / TCP 192.168.1.106:58005 > 17.57.145.8:5223 FPA / Raw
1587134759.442564 Ether / IP / ICMP 140.82.112.3 > 192.168.1.106 echo-reply 0 / Raw
1587134763.971846 Ether / ARP who has 192.168.1.106 says 192.168.1.254 / Padding
1587134763.97186 Ether / ARP is at 8c:85:90:b2:22:b5 says 192.168.1.106
1587134765.239483 Ether / IP / TCP 192.168.1.106:58091 > 192.168.1.254:8013 S
1587134765.242646 Ether / IP / TCP 192.168.1.254:8013 > 192.168.1.106:58091 RA
1587134765.246686 Ether / ARP who has 169.254.1.1 says 192.168.1.106
1587134766.15904 Ether / IP / UDP / DNS Qry "b'mnsvmag.com.'" 
1587134766.168545 Ether / IP / UDP / DNS Ans "103.48.88.4" 
1587134766.169163 Ether / IP / ICMP 192.168.1.106 > 103.48.88.4 echo-request 0 / Raw
1587134766.247914 Ether / ARP who has 169.254.1.1 says 192.168.1.106
1587134767.170298 Ether / IP / ICMP 192.168.1.106 > 103.48.88.4 echo-request 0 / Raw
1587134769.022119 Ether / ARP who has 192.168.1.106 says 192.168.1.254 / Padding
1587134769.022132 Ether / ARP is at 8c:85:90:b2:22:b5 says 192.168.1.106
1587134770.021698 Ether / IP / TCP 172.217.166.42:https > 192.168.1.106:58064 A
1587134770.021728 Ether / IP / TCP 192.168.1.106:58064 > 172.217.166.42:https A
1587134770.07695 Ether / IP / TCP 172.217.166.42:https > 192.168.1.106:58064 A
1587134770.412445 Ether / IP / TCP 192.168.1.106:58005 > 17.57.145.8:5223 FPA / Raw
1587134770.592473 Ether / IP / UDP / DNS Qry "b'logpoint.com.'" 
1587134770.606399 Ether / IP / UDP / DNS Ans "104.27.156.142" 
1587134770.607057 Ether / IP / ICMP 192.168.1.106 > 104.27.156.142 echo-request 0 / Raw
1587134770.618869 Ether / IP / ICMP 104.27.156.142 > 192.168.1.106 echo-reply 0 / Raw
1587134771.612363 Ether / IP / ICMP 192.168.1.106 > 104.27.156.142 echo-request 0 / Raw
1587134771.627528 Ether / IP / ICMP 104.27.156.142 > 192.168.1.106 echo-reply 0 / Raw
1587134772.856505 Ether / IP / TCP 17.57.145.69:5223 > 192.168.1.106:58086 A
1587134772.856617 Ether / IP / TCP 192.168.1.106:58086 > 17.57.145.69:5223 A
1587134773.068061 Ether / IP / TCP 17.57.145.69:5223 > 192.168.1.106:58086 R
